{
  "$id": "https://torchlens.dev/schemas/torchlens.agent.envelope.v1.json",
  "$schema": "https://json-schema.org/draft/2020-12/schema",
  "additionalProperties": true,
  "properties": {
    "artifact": {
      "type": [
        "object",
        "null"
      ]
    },
    "data": {},
    "limits": {
      "type": "object"
    },
    "request": {
      "type": "object"
    },
    "schema": {
      "type": "string"
    },
    "schema_stability": {
      "const": "documented-unstable"
    },
    "status": {
      "type": "string"
    },
    "torchlens_version": {
      "type": "string"
    },
    "truncation": {
      "type": [
        "object",
        "null"
      ]
    },
    "warnings": {
      "items": {
        "type": "string"
      },
      "type": "array"
    }
  },
  "required": [
    "artifact",
    "data",
    "limits",
    "request",
    "schema",
    "schema_stability",
    "status",
    "torchlens_version",
    "truncation",
    "warnings"
  ],
  "title": "The shared agent-surface result envelope",
  "type": "object"
}
