{"artifact":{"basename":"clean.tlspec","created_at":"2026-10-31T14:08:23Z","id":"sha256:c60083a4d2089e9a54bbc507c40f551dd25b8cdd62072a2bfa290e2c9930e71f","kind":"trace","model_fingerprint":"77987320eae30dd2031428b62ff8be2746befe0736358a7a84775cb1d7d9e335","model_signature":"test_agent_surface_helpers.RepeatedBlockNet","tlspec_version":11,"torchlens_version_at_save":"2.36.1"},"data":{"handoff":"[str(op.label) for op in log.layer_list if (op.func_name == 'relu')]","header":{"matches_total":3,"population_total":9,"query_ast_version":"torchlens.agent_query.v1"},"load_plan":{"declared_payload_bytes":192,"declared_payload_count":3,"eager_threshold_bytes":268435456,"max_payload_entries":100000,"mode":"eager","reason":"declared payload bytes fit the eager threshold"},"next":null,"offset":0,"rows":[{"children":["linear_2_3"],"device":"cpu","dtype":"torch.float32","flops_forward":16,"func_name":"relu","is_input":false,"is_output":false,"label":"relu_1_2:1","layer_label":"relu_1_2","matched":[{"op":"func","value":"relu"}],"module_address":"blocks.0.1","module_call_stack":["blocks.0:1","blocks.0.1:1"],"module_containment":"blocks.0.1","num_params":0,"num_passes":1,"parents":["linear_1_1"],"pass_index":1,"payload_state":"present","saved":true,"shape":[2,8],"site_key":"s1|blocks.0/blocks.0.1|relu||1"},{"children":["linear_3_5"],"device":"cpu","dtype":"torch.float32","flops_forward":16,"func_name":"relu","is_input":false,"is_output":false,"label":"relu_2_4:1","layer_label":"relu_2_4","matched":[{"op":"func","value":"relu"}],"module_address":"blocks.1.1","module_call_stack":["blocks.1:1","blocks.1.1:1"],"module_containment":"blocks.1.1","num_params":0,"num_passes":1,"parents":["linear_2_3"],"pass_index":1,"payload_state":"present","saved":true,"shape":[2,8],"site_key":"s1|blocks.1/blocks.1.1|relu||1"},{"children":["linear_4_7"],"device":"cpu","dtype":"torch.float32","flops_forward":16,"func_name":"relu","is_input":false,"is_output":false,"label":"relu_3_6:1","layer_label":"relu_3_6","matched":[{"op":"func","value":"relu"}],"module_address":"blocks.2.1","module_call_stack":["blocks.2:1","blocks.2.1:1"],"module_containment":"blocks.2.1","num_params":0,"num_passes":1,"parents":["linear_3_5"],"pass_index":1,"payload_state":"present","saved":true,"shape":[2,8],"site_key":"s1|blocks.2/blocks.2.1|relu||1"}]},"limits":{"max_rows":150,"max_tokens":25000,"token_estimator":"approx_chars_div_4"},"request":{"path":"<ARTIFACT>","query":{"op":"func","value":"relu"}},"schema":"torchlens.agent.query_sites.v1","schema_stability":"documented-unstable","status":"ok","torchlens_version":"GOLDEN","truncation":null,"warnings":[]}
