{"artifact":{"basename":"clean.tlspec","created_at":"2026-10-31T09:22:58Z","id":"sha256:ccc1b86b6dd658e83207d3c2dab321c4ba1045f9317c5a60f5efd12d846f960d","kind":"trace","model_fingerprint":"77987320eae30dd2031428b62ff8be2746befe0736358a7a84775cb1d7d9e335","model_signature":"test_agent_surface_helpers.RepeatedBlockNet","tlspec_version":10,"torchlens_version_at_save":"2.36.1"},"data":{"handoff":"tl.trace(model, x, save=tl.func('relu'))","header":{"accumulation_dtype":"float64","bytes_materialized":64,"population_total":1,"ranking":"stable_flat_index_ties","rows_returned":1,"std_correction":0,"target":"out"},"load_plan":{"declared_payload_bytes":192,"declared_payload_count":3,"eager_threshold_bytes":268435456,"max_payload_entries":100000,"mode":"eager","reason":"declared payload bytes fit the eager threshold"},"rows":[{"bytes":64,"dtype":"torch.float32","finite_count":16,"l1_norm":3.127688765525818,"l2_norm":1.1855290550764042,"label":"relu_1_2:1","max":0.6799103021621704,"mean":0.19548054784536362,"min":0.0,"nan_count":0,"neginf_count":0,"numel":16,"posinf_count":0,"shape":[2,8],"status":"ok","std":0.2227774712374963,"target":"out","zero_count":7}]},"limits":{"max_blob_bytes":67108864,"max_call_bytes":134217728,"max_rows":150,"max_tokens":25000,"token_estimator":"approx_chars_div_4"},"request":{"labels":["relu_1_2:1"],"path":"<ARTIFACT>"},"schema":"torchlens.agent.payload_stats.v1","schema_stability":"documented-unstable","status":"ok","torchlens_version":"GOLDEN","truncation":null,"warnings":[]}
