{"artifact":{"basename":"clean.tlspec","created_at":"2026-10-31T16:55:16Z","id":"sha256:a1858127f09bd6b0d15486aa2caabb2bab4d9e8bf597fd5307d67546d32932a2","kind":"trace","model_fingerprint":"77987320eae30dd2031428b62ff8be2746befe0736358a7a84775cb1d7d9e335","model_signature":"test_agent_surface_helpers.RepeatedBlockNet","tlspec_version":11,"torchlens_version_at_save":"2.36.1"},"data":{"anomalies":[],"audit":{"health":{"alias_nonfinite_labels":[],"basis":"persisted","checked":3,"nonfinite_labels":[],"unchecked":0,"unexamined":6,"verdict":"not_checked"},"nonfinite":{"basis":"saved_payloads","labels":[],"n_labels":0}},"capture":{"backend":"torch","capture_status":"complete","capture_verification_reason":null,"capture_verified":null,"device_summary":null,"grouping":"structural","has_backward_pass":false,"model_class":"RepeatedBlockNet","poisoned":false,"rescue_rerun":false,"structure_only":false},"classes":[{"boundary":"input","child_classes":["c0001"],"class_id":"c0000","device":null,"dtype":"torch.float32","func":"none","module_path":[],"n_instances":1,"num_params":0,"parent_classes":[],"payload_state":"unsaved","rank":2,"representative":"input_1:1","saved":false,"shape":[2,8]},{"child_classes":["c0002"],"class_id":"c0001","device":null,"dtype":"torch.float32","func":"linear","module_path":["blocks.*","blocks.*.*"],"n_instances":3,"num_params":72,"parent_classes":["c0000","c0002"],"payload_state":"unsaved","rank":2,"representative":"linear_1_1:1","saved":false,"shape":[2,8]},{"child_classes":["c0001","c0003"],"class_id":"c0002","device":"cpu","dtype":"torch.float32","func":"relu","module_path":["blocks.*","blocks.*.*"],"n_instances":3,"num_params":0,"parent_classes":["c0001"],"payload_state":"present","rank":2,"representative":"relu_1_2:1","saved":true,"shape":[2,8]},{"child_classes":["c0004"],"class_id":"c0003","device":null,"dtype":"torch.float32","func":"linear","module_path":["head"],"n_instances":1,"num_params":18,"parent_classes":["c0002"],"payload_state":"unsaved","rank":2,"representative":"linear_4_7:1","saved":false,"shape":[2,2]},{"boundary":"output","child_classes":[],"class_id":"c0004","device":null,"dtype":"torch.float32","func":"none","module_path":[],"n_instances":1,"num_params":0,"parent_classes":["c0003"],"payload_state":"unsaved","rank":2,"representative":"output_1:1","saved":false,"shape":[2,2]}],"counts":{"alias_rows":2,"compute_ops":7,"layers":9,"modules":11,"operations":9,"parameters":234,"tensors_saved":3,"tensors_total":9},"coverage":{"grads_available":0,"ops_total":9,"payload_lazy":0,"payload_present":3,"payload_unsaved":6},"fold_key":"torchlens.agent_fold_key.v1","inputs":["input_1:1"],"interventions":null,"load_plan":{"declared_payload_bytes":192,"declared_payload_count":3,"eager_threshold_bytes":268435456,"max_payload_entries":100000,"mode":"eager","reason":"declared payload bytes fit the eager threshold"},"logged_values":{},"memory":{"at_capture_bytes":192,"at_capture_saved_ops":3,"retained_now_bytes":192,"retained_now_lazy_ops":0,"retained_now_present_ops":3,"scope_note":"at_capture is a capture fact; retained_now describes THIS object"},"n_classes":5,"next_operations":{"graph_rows":"call_tool(\"torchlens_dump\", {\"path\": <path>, \"view\": \"graph\"})","report":"call_tool(\"torchlens_explain\", {\"path\": <path>, \"max_tokens\": 2000})","sites":"call_tool(\"torchlens_query_sites\", {\"path\": <path>})","values":"call_tool(\"torchlens_payload_stats\", {\"path\": <path>})"},"outputs":["output_1:1"]},"limits":{"max_tokens":12000,"token_estimator":"approx_chars_div_4"},"request":{"path":"<ARTIFACT>"},"schema":"torchlens.agent.overview_folded.v1","schema_stability":"documented-unstable","status":"ok","torchlens_version":"GOLDEN","truncation":null,"warnings":[]}
